{
  "schemaVersion": "v0.0.1:schema:meshrix-plugin-manifest-1",
  "kind": "meshrix.plugin.manifest",
  "id": "agent-openclaw",
  "name": "OpenClaw Agent Adapter",
  "status": "stable",
  "types": [
    "client-peer-plugin"
  ],
  "summary": "OpenClaw peer adapter plugin.",
  "group": "agents",
  "integration": {
    "sourceBoundary": "Repository-local optional adapter using only public Meshrix extension boundaries.",
    "meshrixBoundaries": [
      "target agent peer plugin configuration"
    ],
    "operations": [],
    "toolsets": [],
    "mountNames": [],
    "coveredCapabilities": ["OpenClaw MCP installation, discovery, verification, and removal"]
  },
  "security": {
    "secrets": [],
    "risk": "mixed",
    "notes": [
      "Use the selected environment reference in native MCP headers; generic SecretRef header objects are not supported.",
      "Expose agent-facing calls through Operation Permission v1 after policy review.",
      "Do not commit provider runtime data or local operator paths."
    ]
  },
  "artifacts": {
    "externalServiceConfigs": [],
    "capabilityPackages": [],
    "docs": ["README.md"],
    "clientAdapter": "adapter.json"
  }
}
