{
  "schemaVersion": "v0.0.1:schema:meshrix-plugin-manifest-1",
  "kind": "meshrix.plugin.manifest",
  "id": "agent-antigravity",
  "name": "Antigravity Agent Adapter",
  "status": "stable",
  "types": [
    "client-peer-plugin"
  ],
  "summary": "Antigravity capability assessment; protected Meshrix header references remain unqualified.",
  "group": "agents",
  "integration": {
    "sourceBoundary": "Repository-local optional adapter using only public Meshrix extension boundaries.",
    "meshrixBoundaries": [
      "target agent peer plugin configuration"
    ],
    "operations": [],
    "toolsets": [],
    "mountNames": [],
    "coveredCapabilities": ["Native capability assessment and matching generated-registration removal"]
  },
  "security": {
    "secrets": [],
    "risk": "mixed",
    "notes": [
      "No protected static-key header reference is qualified; installation fails without mutation or fallback.",
      "Expose agent-facing calls through Operation Permission v1 after policy review.",
      "Do not commit provider runtime data or local operator paths."
    ]
  },
  "artifacts": {
    "externalServiceConfigs": [],
    "capabilityPackages": [],
    "docs": ["README.md"],
    "clientAdapter": "adapter.json"
  }
}
